{
  "schema_version": "2.0.0",
  "kind": "action-request",
  "feature": {
    "id": "authentication-password-recovery",
    "name": "Password recovery",
    "description": "Public request for password-reset instructions."
  },
  "backend_contract": {
    "uri": "tools/generator-platform/fixtures/forgot-password.backend-contract.json",
    "id": "authentication-api-client-observation",
    "version": "1.0.0",
    "sha256": "728e347c50db9a97f7977a7b76f5a52bfe6e59a4fd9fbc9729cc45346d6a021d"
  },
  "operations": [
    {
      "id": "forgot-password",
      "operation_ref": {
        "operation_id": "authentication.forgot-password"
      },
      "success_response_status": 200,
      "input": {
        "fields": [
          {
            "name": "email",
            "body_field": "email",
            "validations": [
              { "kind": "required" },
              { "kind": "format", "format": "email" }
            ]
          }
        ]
      },
      "result_model": {
        "id": "forgot-password-result",
        "description": "Message returned after accepting the reset request.",
        "fields": [{ "name": "message", "source_field": "message" }]
      },
      "execution": {
        "concurrency": "reject-while-pending",
        "retry": { "mode": "none" },
        "idempotency": { "mode": "none" },
        "invalidation": { "mode": "none" },
        "post_success": { "mode": "none" }
      }
    }
  ]
}
